<?xml version='1.0' encoding='UTF-8'?>
<regionyields xmlns:xsi="http://www.w3.org/2001/XMLSchema-instance" xsi:noNamespaceSchemaLocation="regionyields.xsd">
  <resource ware="ore" effect_r="207" effect_g="127" effect_b="84">
    <yield name="lowest" resourcedensity="0.026" replenishtime="600" scaneffect="scfx_dynamic_lowyield_01" scaneffectdensity="0.01" scaneffectintensity="0.1"/>
    <yield name="verylow" resourcedensity="0.06" replenishtime="1200" scaneffect="scfx_dynamic_lowyield_01" scaneffectdensity="0.01" scaneffectintensity="0.3"/>
    <yield name="lowminus" resourcedensity="0.2" replenishtime="1200" scaneffect="scfx_dynamic_lowyield_01" scaneffectdensity="0.01" scaneffectintensity="0.3"/>
    <yield name="low" resourcedensity="0.6" replenishtime="1800" scaneffect="scfx_dynamic_lowyield_01" scaneffectdensity="0.01" scaneffectintensity="0.6"/>
    <yield name="lowplus" resourcedensity="1.8" replenishtime="1800" scaneffect="scfx_dynamic_lowyield_01" scaneffectdensity="0.01" scaneffectintensity="0.6"/>
    <yield name="lowextra" resourcedensity="3.2" replenishtime="1900" scaneffect="scfx_dynamic_lowyield_01" scaneffectdensity="0.01" scaneffectintensity="0.6"/>
    <yield name="medlow" resourcedensity="4" replenishtime="2000" scaneffect="scfx_dynamic_normalyield_01" scaneffectdensity="0.01" scaneffectintensity="1.0"/>
    <yield name="medium" resourcedensity="6" replenishtime="2400" scaneffect="scfx_dynamic_normalyield_01" scaneffectdensity="0.01" scaneffectintensity="1.0"/>
    <yield name="medplus" resourcedensity="16" replenishtime="2400" scaneffect="scfx_dynamic_normalyield_01" scaneffectdensity="0.01" scaneffectintensity="1.0"/>
    <yield name="medhigh" resourcedensity="32" replenishtime="2400" scaneffect="scfx_dynamic_normalyield_01" scaneffectdensity="0.01" scaneffectintensity="1.0"/>
    <yield name="highlow" resourcedensity="48" replenishtime="3600" scaneffect="scfx_dynamic_highyield_01" scaneffectdensity="0.01" scaneffectintensity="1.0"/>
    <yield name="high" resourcedensity="60" replenishtime="3600" scaneffect="scfx_dynamic_highyield_01" scaneffectdensity="0.01" scaneffectintensity="1.0"/>
    <yield name="highplus" resourcedensity="120" replenishtime="3600" scaneffect="scfx_dynamic_highyield_01" scaneffectdensity="0.01" scaneffectintensity="1.0"/>
    <yield name="veryhigh" resourcedensity="3600" replenishtime="18000" scaneffect="scfx_dynamic_highyield_01" scaneffectdensity="0.01" scaneffectintensity="1.0"/>
    <yield name="highest" resourcedensity="60000" replenishtime="24000" scaneffect="scfx_dynamic_highyield_01" scaneffectdensity="0.01" scaneffectintensity="1.0"/>
  </resource>
  <resource ware="silicon" effect_r="166" effect_g="166" effect_b="175">
    <yield name="lowest" resourcedensity="0.026" replenishtime="600" scaneffect="scfx_dynamic_lowyield_01" scaneffectdensity="0.01" scaneffectintensity="0.1"/>
    <yield name="verylow" resourcedensity="0.06" replenishtime="1200" scaneffect="scfx_dynamic_lowyield_01" scaneffectdensity="0.01" scaneffectintensity="0.3"/>
    <yield name="lowminus" resourcedensity="0.2" replenishtime="1200" scaneffect="scfx_dynamic_lowyield_01" scaneffectdensity="0.01" scaneffectintensity="0.3"/>
    <yield name="low" resourcedensity="0.6" replenishtime="1800" scaneffect="scfx_dynamic_lowyield_01" scaneffectdensity="0.01" scaneffectintensity="0.6"/>
    <yield name="lowplus" resourcedensity="1.8" replenishtime="1800" scaneffect="scfx_dynamic_lowyield_01" scaneffectdensity="0.01" scaneffectintensity="0.6"/>
    <yield name="lowextra" resourcedensity="3.2" replenishtime="1900" scaneffect="scfx_dynamic_lowyield_01" scaneffectdensity="0.01" scaneffectintensity="0.6"/>
    <yield name="medlow" resourcedensity="4" replenishtime="2000" scaneffect="scfx_dynamic_normalyield_01" scaneffectdensity="0.01" scaneffectintensity="1.0"/>
    <yield name="medium" resourcedensity="6" replenishtime="2400" scaneffect="scfx_dynamic_normalyield_01" scaneffectdensity="0.01" scaneffectintensity="1.0"/>
    <yield name="medplus" resourcedensity="16" replenishtime="2400" scaneffect="scfx_dynamic_normalyield_01" scaneffectdensity="0.01" scaneffectintensity="1.0"/>
    <yield name="medhigh" resourcedensity="32" replenishtime="2400" scaneffect="scfx_dynamic_normalyield_01" scaneffectdensity="0.01" scaneffectintensity="1.0"/>
    <yield name="highlow" resourcedensity="48" replenishtime="3600" scaneffect="scfx_dynamic_highyield_01" scaneffectdensity="0.01" scaneffectintensity="1.0"/>
    <yield name="high" resourcedensity="60" replenishtime="3600" scaneffect="scfx_dynamic_highyield_01" scaneffectdensity="0.01" scaneffectintensity="1.0"/>
    <yield name="highplus" resourcedensity="120" replenishtime="3600" scaneffect="scfx_dynamic_highyield_01" scaneffectdensity="0.01" scaneffectintensity="1.0"/>
    <yield name="veryhigh" resourcedensity="3600" replenishtime="18000" scaneffect="scfx_dynamic_highyield_01" scaneffectdensity="0.01" scaneffectintensity="1.0"/>
    <yield name="highest" resourcedensity="60000" replenishtime="24000" scaneffect="scfx_dynamic_highyield_01" scaneffectdensity="0.01" scaneffectintensity="1.0"/>
  </resource>
  <resource ware="ice" effect_r="208" effect_g="208" effect_b="215">
    <yield name="lowest" resourcedensity="0.015" replenishtime="180" scaneffect="scfx_dynamic_lowyield_01" scaneffectdensity="0.01" scaneffectintensity="0.3"/>
    <yield name="verylow" resourcedensity="0.15" replenishtime="180" scaneffect="scfx_dynamic_lowyield_01" scaneffectdensity="0.01" scaneffectintensity="0.3"/>
    <yield name="lowminus" resourcedensity="0.6" replenishtime="300" scaneffect="scfx_dynamic_lowyield_01" scaneffectdensity="0.01" scaneffectintensity="0.3"/>
    <yield name="low" resourcedensity="1.5" replenishtime="300" scaneffect="scfx_dynamic_lowyield_01" scaneffectdensity="0.01" scaneffectintensity="1.0"/>
    <yield name="lowplus" resourcedensity="4" replenishtime="600" scaneffect="scfx_dynamic_lowyield_01" scaneffectdensity="0.01" scaneffectintensity="1.0"/>
    <yield name="lowextra" resourcedensity="8" replenishtime="600" scaneffect="scfx_dynamic_lowyield_01" scaneffectdensity="0.01" scaneffectintensity="1.0"/>
    <yield name="medlow" resourcedensity="9" replenishtime="600" scaneffect="scfx_dynamic_normalyield_01" scaneffectdensity="0.01" scaneffectintensity="1.0"/>
    <yield name="medium" resourcedensity="15" replenishtime="600" scaneffect="scfx_dynamic_normalyield_01" scaneffectdensity="0.01" scaneffectintensity="1.0"/>
    <yield name="medplus" resourcedensity="30" replenishtime="2400" scaneffect="scfx_dynamic_normalyield_01" scaneffectdensity="0.01" scaneffectintensity="1.0"/>
    <yield name="medhigh" resourcedensity="60" replenishtime="600" scaneffect="scfx_dynamic_normalyield_01" scaneffectdensity="0.01" scaneffectintensity="1.0"/>
    <yield name="highlow" resourcedensity="90" replenishtime="3600" scaneffect="scfx_dynamic_highyield_01" scaneffectdensity="0.01" scaneffectintensity="1.0"/>
    <yield name="high" resourcedensity="150" replenishtime="1200" scaneffect="scfx_dynamic_highyield_01" scaneffectdensity="0.01" scaneffectintensity="1.0"/>
    <yield name="highplus" resourcedensity="600" replenishtime="3600" scaneffect="scfx_dynamic_highyield_01" scaneffectdensity="0.01" scaneffectintensity="1.0"/>
    <yield name="veryhigh" resourcedensity="1500" replenishtime="2400" scaneffect="scfx_dynamic_highyield_01" scaneffectdensity="0.01" scaneffectintensity="1.0"/>
    <yield name="highest" resourcedensity="30000" replenishtime="18000" scaneffect="scfx_dynamic_highyield_01" scaneffectdensity="0.01" scaneffectintensity="1.0"/>
  </resource>
  <resource ware="nividium" effect_r="230" effect_g="150" effect_b="230">
    <yield name="lowest" resourcedensity="0.00001" replenishtime="2400" scaneffect="scfx_dynamic_lowyield_01" scaneffectdensity="0.01" scaneffectintensity="1.0"/>
    <yield name="verylow" resourcedensity="0.00003" replenishtime="3600" scaneffect="scfx_dynamic_lowyield_01" scaneffectdensity="0.01" scaneffectintensity="1.0"/>
    <yield name="lowminus" resourcedensity="0.00005" replenishtime="4800" scaneffect="scfx_dynamic_lowyield_01" scaneffectdensity="0.01" scaneffectintensity="1.0"/>
    <yield name="low" resourcedensity="0.0001" replenishtime="5040" scaneffect="scfx_dynamic_lowyield_01" scaneffectdensity="0.01" scaneffectintensity="1.0"/>
    <yield name="lowplus" resourcedensity="0.0002" replenishtime="6400" scaneffect="scfx_dynamic_lowyield_01" scaneffectdensity="0.01" scaneffectintensity="1.0"/>
    <yield name="lowextra" resourcedensity="0.0004" replenishtime="7000" scaneffect="scfx_dynamic_lowyield_01" scaneffectdensity="0.01" scaneffectintensity="1.0"/>
    <yield name="medlow" resourcedensity="0.0006" replenishtime="7200" scaneffect="scfx_dynamic_normalyield_01" scaneffectdensity="0.01" scaneffectintensity="1.0"/>
    <yield name="medium" resourcedensity="0.001" replenishtime="10080" scaneffect="scfx_dynamic_normalyield_01" scaneffectdensity="0.01" scaneffectintensity="1.0"/>
    <yield name="medplus" resourcedensity="0.002" replenishtime="12440" scaneffect="scfx_dynamic_normalyield_01" scaneffectdensity="0.01" scaneffectintensity="1.0"/>
    <yield name="medhigh" resourcedensity="0.004" replenishtime="14400" scaneffect="scfx_dynamic_normalyield_01" scaneffectdensity="0.01" scaneffectintensity="1.0"/>
    <yield name="highlow" resourcedensity="0.008" replenishtime="16800" scaneffect="scfx_dynamic_highyield_01" scaneffectdensity="0.01" scaneffectintensity="1.0"/>
    <yield name="high" resourcedensity="0.01" replenishtime="20160" scaneffect="scfx_dynamic_highyield_01" scaneffectdensity="0.01" scaneffectintensity="1.0"/>
    <yield name="highplus" resourcedensity="0.04" replenishtime="32000" scaneffect="scfx_dynamic_highyield_01" scaneffectdensity="0.01" scaneffectintensity="1.0"/>
    <yield name="veryhigh" resourcedensity="0.1" replenishtime="40320" scaneffect="scfx_dynamic_highyield_01" scaneffectdensity="0.01" scaneffectintensity="1.0"/>